{
  "schemaVersion": "1.0.0",
  "id": "solar-rapidfire",
  "name": "Solar Rapidfire",
  "set": 18,
  "patch": "18.1",
  "source": "scraped-feed",
  "tier": "A",
  "playstyle": "slow_roll",
  "difficulty": "medium",
  "description": "A-tier slow roll comp built around Attuned and Solar.",
  "units": [
    {
      "name": "Leona",
      "cost": 1,
      "starTarget": 2,
      "role": "frontline",
      "traits": [
        "Solar",
        "Defender"
      ]
    },
    {
      "name": "Varus",
      "cost": 1,
      "starTarget": 2,
      "role": "frontline",
      "traits": [
        "Inferno",
        "Rapidfire"
      ]
    },
    {
      "name": "Kayle",
      "cost": 2,
      "starTarget": 3,
      "role": "carry",
      "traits": [
        "Solar",
        "Rapidfire"
      ]
    },
    {
      "name": "Sejuani",
      "cost": 2,
      "starTarget": 3,
      "role": "carry",
      "traits": [
        "Solar",
        "Juggernaut"
      ]
    },
    {
      "name": "Shen",
      "cost": 2,
      "starTarget": 2,
      "role": "frontline",
      "traits": [
        "Inferno",
        "Defender"
      ]
    },
    {
      "name": "Diana",
      "cost": 3,
      "starTarget": 2,
      "role": "frontline",
      "traits": [
        "Lunar",
        "Ravager",
        "Vanguard"
      ]
    },
    {
      "name": "Aphelios",
      "cost": 4,
      "starTarget": 2,
      "role": "utility",
      "traits": [
        "Lunar",
        "Rapidfire"
      ]
    },
    {
      "name": "Alune",
      "cost": 5,
      "starTarget": 1,
      "role": "utility",
      "traits": [
        "Attuned",
        "Lunar",
        "Spellweaver"
      ]
    }
  ],
  "carries": [
    {
      "unit": "Kayle",
      "itemPriority": [
        "Guinsoo's Rageblade",
        "Guinsoo's Rageblade",
        "Jeweled Gauntlet"
      ]
    },
    {
      "unit": "Sejuani",
      "itemPriority": [
        "Gargoyle Stoneplate",
        "Spirit Visage",
        "Warmog's Armor"
      ]
    }
  ],
  "boardPositioning": {
    "grid": [
      [
        null,
        null,
        "Leona",
        "Shen",
        "Diana",
        "Sejuani",
        null
      ],
      [
        null,
        null,
        null,
        null,
        null,
        null,
        null
      ],
      [
        null,
        null,
        null,
        null,
        null,
        null,
        null
      ],
      [
        "Aphelios",
        null,
        "Varus",
        null,
        "Alune",
        null,
        "Kayle"
      ]
    ]
  },
  "augmentPreferences": {
    "tier1": [],
    "tier2": [],
    "tier3": []
  },
  "levelPlan": [
    {
      "stage": "3-2",
      "level": 6,
      "notes": "Prioritize: Leona, Varus, Kayle, Sejuani, Shen"
    },
    {
      "stage": "5-2",
      "level": 9,
      "notes": "At level 9 you can add: Amumu."
    }
  ],
  "earlyUnits": [
    "Leona",
    "Varus",
    "Kayle",
    "Sejuani",
    "Shen"
  ],
  "earlyOpener": "Prioritize Leona, Varus, Kayle, Sejuani, Shen early; these carry the comp online before its full identity is committed.",
  "pivotNotes": "Swaps this comp commonly runs: Alune → Amumu, Kennen."
}
