{
  "schemaVersion": "1.0.0",
  "id": "consuming-flora",
  "name": "Consuming Flora",
  "set": 18,
  "patch": "18.1",
  "source": "scraped-feed",
  "tier": "S",
  "playstyle": "slow_roll",
  "difficulty": "medium",
  "description": "S-tier slow roll comp built around Flora Fatalis and Sprykin.",
  "units": [
    {
      "name": "Kobuko",
      "cost": 1,
      "starTarget": 2,
      "role": "frontline",
      "traits": [
        "Sprykin",
        "Brawler"
      ]
    },
    {
      "name": "Rek'Sai",
      "cost": 1,
      "starTarget": 3,
      "role": "carry",
      "traits": [
        "Blackthorn",
        "Brawler"
      ]
    },
    {
      "name": "Veigar",
      "cost": 1,
      "starTarget": 3,
      "role": "carry",
      "traits": [
        "Blackthorn",
        "Sprykin",
        "Spellweaver"
      ]
    },
    {
      "name": "Teemo",
      "cost": 2,
      "starTarget": 2,
      "role": "frontline",
      "traits": [
        "Sprykin",
        "Invoker"
      ]
    },
    {
      "name": "Fiddlesticks",
      "cost": 3,
      "starTarget": 2,
      "role": "frontline",
      "traits": [
        "Flora Fatalis",
        "Defender",
        "Spellweaver"
      ]
    },
    {
      "name": "Rammus",
      "cost": 3,
      "starTarget": 2,
      "role": "frontline",
      "traits": [
        "Sprykin",
        "Defender"
      ]
    },
    {
      "name": "Sett",
      "cost": 4,
      "starTarget": 2,
      "role": "utility",
      "traits": [
        "Blossom",
        "Brawler"
      ]
    },
    {
      "name": "Gnar",
      "cost": 5,
      "starTarget": 1,
      "role": "utility",
      "traits": [
        "Elderwood",
        "Sprykin",
        "Brawler"
      ]
    }
  ],
  "carries": [
    {
      "unit": "Rek'Sai",
      "itemPriority": [
        "Gargoyle Stoneplate",
        "Sunfire Cape",
        "Warmog's Armor"
      ]
    },
    {
      "unit": "Veigar",
      "itemPriority": [
        "Blue Buff",
        "Jeweled Gauntlet"
      ]
    }
  ],
  "boardPositioning": {
    "grid": [
      [
        null,
        "Rammus",
        "Sett",
        "Fiddlesticks",
        "Gnar",
        "Rek'Sai",
        null
      ],
      [
        null,
        null,
        null,
        null,
        null,
        null,
        null
      ],
      [
        null,
        null,
        null,
        "Kobuko",
        null,
        null,
        null
      ],
      [
        "Teemo",
        null,
        null,
        null,
        null,
        null,
        "Veigar"
      ]
    ]
  },
  "augmentPreferences": {
    "tier1": [],
    "tier2": [],
    "tier3": []
  },
  "levelPlan": [
    {
      "stage": "3-2",
      "level": 6,
      "notes": "Prioritize: Kobuko, Rek'Sai, Veigar, Teemo, Fiddlesticks"
    },
    {
      "stage": "5-2",
      "level": 9,
      "notes": "At level 9 you can add: Ivern."
    }
  ],
  "earlyOpener": "Prioritize Kobuko, Rek'Sai, Veigar, Teemo, Fiddlesticks early; these carry the comp online before its full identity is committed.",
  "pivotNotes": "Swaps this comp commonly runs: Gnar → Tristana."
}
